<?xml version="1.0" encoding="UTF-8" standalone="no"?><modulo_profesor xmlns:xsi="http://www.w3.org/2001/XMLSchema-instance" xsi:noNamespaceSchemaLocation="Modulo_Profesor_esquema.xsd">
<usuario>
	<nombre></nombre>
        <titulo></titulo>
        <tipo></tipo>
	<contador_contenedores></contador_contenedores>
	<contador_numerador></contador_numerador>
	<contador_denominador></contador_denominador>
	<contador_figura></contador_figura>			
	<contenedor_principal></contenedor_principal>
	<contenedor_objetos_draggables></contenedor_objetos_draggables>              
</usuario>
</modulo_profesor>